{
  "exams": [
    { "id": "ssc", "title": "SSC", "order": 1, "isActive": true },
    { "id": "banking", "title": "Banking", "order": 2, "isActive": true },
    { "id": "railways", "title": "Railways", "order": 3, "isActive": true },
    { "id": "state", "title": "State government exams", "order": 4, "isActive": true },
    { "id": "other", "title": "Other competitive exams", "order": 5, "isActive": true }
  ],
  "subjects": [
    { "id": "aptitude", "title": "Quantitative Aptitude", "order": 1, "isActive": true },
    { "id": "reasoning", "title": "Logical Reasoning", "order": 2, "isActive": true }
  ],
  "topics": [
    { "id": "number-system", "title": "Number System", "subject": "aptitude", "order": 1, "isActive": true },
    { "id": "simplification", "title": "Simplification", "subject": "aptitude", "order": 2, "isActive": true },
    { "id": "percentage", "title": "Percentage", "subject": "aptitude", "order": 3, "isActive": true },
    { "id": "profit-loss", "title": "Profit and Loss", "subject": "aptitude", "order": 4, "isActive": true },
    { "id": "simple-interest", "title": "Simple Interest", "subject": "aptitude", "order": 5, "isActive": true },
    { "id": "compound-interest", "title": "Compound Interest", "subject": "aptitude", "order": 6, "isActive": true },
    { "id": "ratio-proportion", "title": "Ratio and Proportion", "subject": "aptitude", "order": 7, "isActive": true },
    { "id": "average", "title": "Average", "subject": "aptitude", "order": 8, "isActive": true },
    { "id": "time-work", "title": "Time and Work", "subject": "aptitude", "order": 9, "isActive": true },
    { "id": "time-speed-distance", "title": "Time Speed Distance", "subject": "aptitude", "order": 10, "isActive": true },
    { "id": "partnership", "title": "Partnership", "subject": "aptitude", "order": 11, "isActive": true },
    { "id": "mixture-alligation", "title": "Mixture and Alligation", "subject": "aptitude", "order": 12, "isActive": true },
    { "id": "algebra", "title": "Algebra", "subject": "aptitude", "order": 13, "isActive": true },
    { "id": "geometry", "title": "Geometry", "subject": "aptitude", "order": 14, "isActive": true },
    { "id": "mensuration", "title": "Mensuration", "subject": "aptitude", "order": 15, "isActive": true },
    { "id": "data-interpretation", "title": "Data Interpretation", "subject": "aptitude", "order": 16, "isActive": true },
    { "id": "probability", "title": "Probability", "subject": "aptitude", "order": 17, "isActive": true },
    { "id": "permutation-combination", "title": "Permutation and Combination", "subject": "aptitude", "order": 18, "isActive": true },
    { "id": "miscellaneous", "title": "Miscellaneous", "subject": "aptitude", "order": 19, "isActive": true },
    { "id": "analogy", "title": "Analogy", "subject": "reasoning", "order": 20, "isActive": true },
    { "id": "classification", "title": "Classification", "subject": "reasoning", "order": 21, "isActive": true },
    { "id": "series", "title": "Series", "subject": "reasoning", "order": 22, "isActive": true },
    { "id": "coding-decoding", "title": "Coding-Decoding", "subject": "reasoning", "order": 23, "isActive": true },
    { "id": "blood-relations", "title": "Blood Relations", "subject": "reasoning", "order": 24, "isActive": true },
    { "id": "direction-sense", "title": "Direction Sense", "subject": "reasoning", "order": 25, "isActive": true },
    { "id": "ranking", "title": "Ranking", "subject": "reasoning", "order": 26, "isActive": true },
    { "id": "syllogism", "title": "Syllogism", "subject": "reasoning", "order": 27, "isActive": true },
    { "id": "statement-conclusion", "title": "Statement and Conclusion", "subject": "reasoning", "order": 28, "isActive": true },
    { "id": "statement-assumption", "title": "Statement and Assumption", "subject": "reasoning", "order": 29, "isActive": true },
    { "id": "seating-arrangement", "title": "Seating Arrangement", "subject": "reasoning", "order": 30, "isActive": true },
    { "id": "puzzles", "title": "Puzzles", "subject": "reasoning", "order": 31, "isActive": true },
    { "id": "venn-diagram", "title": "Venn Diagram", "subject": "reasoning", "order": 32, "isActive": true },
    { "id": "clocks", "title": "Clocks", "subject": "reasoning", "order": 33, "isActive": true },
    { "id": "calendar", "title": "Calendar", "subject": "reasoning", "order": 34, "isActive": true },
    { "id": "non-verbal", "title": "Non-verbal Reasoning", "subject": "reasoning", "order": 35, "isActive": true },
    { "id": "figure-series", "title": "Figure Series", "subject": "reasoning", "order": 36, "isActive": true },
    { "id": "mirror-image", "title": "Mirror Image", "subject": "reasoning", "order": 37, "isActive": true },
    { "id": "water-image", "title": "Water Image", "subject": "reasoning", "order": 38, "isActive": true }
  ],
  "questions": [
    { "id": "ssc-percentage-001", "exam": "ssc", "subject": "aptitude", "topic": "percentage", "difficulty": "Easy", "type": "MCQ", "questionText": "What is 25% of 240?", "options": ["40", "50", "60", "80"], "correctOption": 2, "explanation": "25% means one quarter. Divide 240 by 4 to get 60.", "shortcut": "25% = 1/4; 12.5% = 1/8.", "source": "Mindway original sample", "isActive": true },
    { "id": "ssc-percentage-002", "exam": "ssc", "subject": "aptitude", "topic": "percentage", "difficulty": "Medium", "type": "MCQ", "questionText": "A price increases by 20% and then decreases by 20%. What is the net change?", "options": ["No change", "4% decrease", "4% increase", "2% decrease"], "correctOption": 1, "explanation": "Start at 100. After a 20% increase it is 120. A 20% decrease on 120 gives 96, a net decrease of 4%.", "shortcut": "Equal successive increase and decrease of x% gives a net loss of x²/100%.", "source": "Mindway original sample", "isActive": true },
    { "id": "ssc-percentage-003", "exam": "ssc", "subject": "aptitude", "topic": "percentage", "difficulty": "Easy", "type": "NUMERICAL", "questionText": "Find 15% of 360.", "numericalAnswer": 54, "tolerance": 0.001, "explanation": "10% is 36 and 5% is 18. Their sum is 54.", "source": "Mindway original sample", "isActive": true },
    { "id": "ssc-percentage-004", "exam": "ssc", "subject": "aptitude", "topic": "percentage", "difficulty": "Medium", "type": "MCQ", "questionText": "A student scores 144 marks out of 180. What is the percentage?", "options": ["70%", "75%", "80%", "85%"], "correctOption": 2, "explanation": "Percentage = (144 ÷ 180) × 100 = 80%.", "source": "Mindway original sample", "isActive": true },
    { "id": "ssc-profit-001", "exam": "ssc", "subject": "aptitude", "topic": "profit-loss", "difficulty": "Easy", "type": "MCQ", "questionText": "An item costs ₹500 and sells for ₹600. Find the profit percentage.", "options": ["10%", "16.67%", "20%", "25%"], "correctOption": 2, "explanation": "Profit is ₹100. Profit percentage = 100/500 × 100 = 20%. Always use cost price as the base.", "source": "Mindway original sample", "isActive": true },
    { "id": "ssc-average-001", "exam": "ssc", "subject": "aptitude", "topic": "average", "difficulty": "Easy", "type": "MCQ", "questionText": "Find the average of 12, 18, 24 and 30.", "options": ["18", "20", "21", "24"], "correctOption": 2, "explanation": "The sum is 84. Divide by 4 to get 21.", "source": "Mindway original sample", "isActive": true },
    { "id": "ssc-work-001", "exam": "ssc", "subject": "aptitude", "topic": "time-work", "difficulty": "Medium", "type": "MCQ", "questionText": "A completes a task in 12 days and B in 6 days. Working together, how long do they take?", "options": ["3 days", "4 days", "6 days", "9 days"], "correctOption": 1, "explanation": "Their combined daily work is 1/12 + 1/6 = 1/4. They finish in 4 days.", "source": "Mindway original sample", "isActive": true },
    { "id": "ssc-interest-001", "exam": "ssc", "subject": "aptitude", "topic": "simple-interest", "difficulty": "Easy", "type": "NUMERICAL", "questionText": "Find the simple interest in rupees on ₹2,000 at 5% per year for 3 years.", "numericalAnswer": 300, "explanation": "SI = PRT/100 = 2000 × 5 × 3 / 100 = ₹300.", "source": "Mindway original sample", "isActive": true },
    { "id": "ssc-series-001", "exam": "ssc", "subject": "reasoning", "topic": "series", "difficulty": "Easy", "type": "MCQ", "questionText": "Find the next number: 3, 6, 12, 24, ?", "options": ["30", "36", "42", "48"], "correctOption": 3, "explanation": "Each number is double the previous number. 24 × 2 = 48.", "source": "Mindway original sample", "isActive": true },
    { "id": "ssc-series-002", "exam": "ssc", "subject": "reasoning", "topic": "series", "difficulty": "Medium", "type": "MCQ", "questionText": "Find the next number: 2, 5, 10, 17, 26, ?", "options": ["35", "36", "37", "39"], "correctOption": 2, "explanation": "Differences are 3, 5, 7, 9. Add the next odd number, 11, to 26 to get 37.", "source": "Mindway original sample", "isActive": true },
    { "id": "ssc-coding-001", "exam": "ssc", "subject": "reasoning", "topic": "coding-decoding", "difficulty": "Easy", "type": "MCQ", "questionText": "If CAT is coded as DBU by shifting each letter one step forward, how is DOG coded?", "options": ["EPH", "CNE", "EPG", "FQI"], "correctOption": 0, "explanation": "D→E, O→P, G→H. DOG becomes EPH.", "source": "Mindway original sample", "isActive": true },
    { "id": "ssc-direction-001", "exam": "ssc", "subject": "reasoning", "topic": "direction-sense", "difficulty": "Easy", "type": "MCQ", "questionText": "A person faces north, turns right, and then turns right again. Which direction are they facing?", "options": ["North", "South", "East", "West"], "correctOption": 1, "explanation": "The first right turn faces east. The second right turn faces south.", "source": "Mindway original sample", "isActive": true },